{
  "v": 1,
  "jobId": "job-abstract-002",
  "userId": "user-456",
  "input": {
    "url": "https://docs.example.com/research-paper.docx",
    "key": "research/ai-advances-2024.docx",
    "mime": "application/vnd.openxmlformats-officedocument.wordprocessingml.document"
  },
  "params": {
    "type": "abstractive",
    "ratio": 0.2
  }
}